Filename,Continent ,Country,Content,Types_ATU
pitcendras_lharassas_pyrenees,Europe,France (Pyrenees),"Le Pitcendras Lharassas
Pyrénées
Il y avait une fois une fillette qui perdit sa maman. Le papa se remaria et eut encore deux filles. La marâtre n'était pas méchante à l'endroit de l’aînée, mais l'enfant devenue jeune fille fuyait les fêtes et les sorties. Cantonnée au coin de l’âtre, près de ses chères cendres, elle préparait les repas. Aussi l’appelait-on « Pitcendrou » et, en mauvaise part, « Pitcendras Lharassas », c’est-à-dire « Petit Cendrier, Souillon du foyer ».
Le père allait régulièrement à la foire. Un jour il prit congé de ses filles en leur posant cette question : — Que vous apporterai-je, mes chéries ?
— Je voudrais une jupe, papa.
— Je désire une robe.
— Et toi, mon petit Cendron ?
— Une noix.
L'aînée rejoignit aussitôt le coin des cendres. Le soir venu, le père distribua ses cadeaux.
— Voici ta jupe. Essaie-la donc, Cadette. Pour ma Benjamine une robe ravissante. J'ai pensé à toi, mon enfant, voici ta noix.
— Que tu es sotte de choisir une noix! lui dit la marâtre. Quand tu l’auras mangée, que te restera-t-il ?
Le dimanche suivant, les deux sœurs de Petit Cendron, un tantinet coquettes — c'est normal à cet âge — voulurent se montrer. — Petit Cendron nous accompagnes-tu à la messe ? Mais Petit Cendron, qui n’était pas convenablement habillée, resta au logis avec ses chères cendres. Quelque temps après, le père leur dit:
— Je vais à la foire. Que désirez-vous, mes filles ? — Pour moi une robe.
— Une jupe cette fois.
— Je ne veux qu’une amande.
— En voilà une gourmande! Tu es imprévoyante, Petit Cendron.
Puis la maman et ses filles se préparèrent afin d’assister à l'office.
— Viens-tu, Petit Cendron ?
— Pas en cet état, tout de même. Elle nous ferait honte, maman, répondit l’une des coquettes.
Une troisième fois, le papa demande aux trois demoiselles de formuler leur souhait. Les jeunettes portèrent leur choix sur un châle. — Pour moi une noisette, papa.
— Ça te remplira le ventre. Une fois mangée ta noisette, tu seras aussi bête que devant.
Les deux sœurs avaient maintenant une toilette complète. Le Petit Cendronn’avait pas pensé à la sienne. Il ne pouvait être question de l'emmener à l’église, ni de la sortir dans les grandes occasions.
Le jour de la fête arriva. Les deux cadettes et la mère assistèrent à la messe. Petit Cendron était demeurée près de l’âtre. Elle ouvrit sa noix.
Elle fut aussitôt revêtue d’une robe couleur des étoiles avec chaussures, coiffure et bijoux assortis, et elle fût transportée aussitôt à l'église. Dès que Poffice fut terminé, elle noua son écharpe et disparut aux yeux de l'assistance. Ses sœurs rentraient émerveillées.
— Nous avons aperçu une beauté, Cendron.
— Certainement pas plus belle que moi.
— Quelle audace ! Comment oses-tu dire cela, Petit Cendrier de l’âtre ? Or, le fils du roi avait été séduit par cette jeune inconnue à la merveilleuse toilette. Il aurait bien voulu causer avec elle, dès la sortie, mais n’avait pu la rejoindre. Peu de temps après, il y eut une nouvelle fête. Cette fois, le prince disposa ses gardes à l’entrée de l’église. Ses deux sœurs parties, Petit Cendron ouvrit son amande. Elle apparut à la messe avec une toilette couleur de la lune; l’éclat en était tel qu’on n’en pouvait supporter la vue. Vers la fin de la cérémonie, elle s’éclipsa. Personne n’avait pu ni lui parler, ni la joindre... Le prince en était pour ses frais.
— Petit Cendrier, rapportèrent ses sœurs, l’inconnue est revenue aujourd’hui, et plus belle que l’autre fois. — Certainement pas plus belle que moi.
— Quelle impudence, ce Petit Cendrier, Souillon du foyer !
Le prince ne s’avouait pas vaincu.
— C’est à n’y rien comprendre, disait-il à ses gardes. Tâchez de l'arrêter à la prochaine apparition.
Il doubla son service d’ordre à la grand’messe qui suivit. Ce jour-là précisément, Petit Cendron ouvrit sa noisette. Elle apparut avec un vêtement couleur du soleil. Dans l’église où elle se glissa sans bruit, l’éclat de ses atours fit pâlir celui de mille cierges. Sa robe éclairait la nef. Selon son habitude, elle sortit juste avant la fin. Les
gardes avaient aperçu une ombre ; l’un d’eux se précipita et saisit un objet au passage.
Petit Cendron venait de perdre une de ses sandales de verre.
Le prince fit entreprendre une enquête afin de retrouver la fille au pied mignon. Toutes les demoiselles du royaume durent se produire au palais afin d'essayer la précieuse sandale. Toutefois, qui trop grand, qui trop petit, aucune ne put glisser le pied dans cette extraordinaire chaussure.
Toute recherche semblait vaine.
— Au moins n'oubliez personne, recommandait le prince.
Ses serviteurs cherchaient par le pays et vinrent jusqu'à la maison. Le maître leur avoua :
— Nous avons bien une autre fille :un souillon qui répond au nom de Petit Cendrier. D’ailleurs, elle n'a jamais quitté la plaque du foyer, tant elle est laide et mal vêtue.
— Nous l’emmenons. C’est l’ordre du prince.
Au palais, Petit Cendron ouvrit sa noisette et apparut dans sa dernière toilette, couleur du Soleil. Bien entendu, la sandale faite pour elle la chaussait à merveille. Il y eut grand émoi dans le palais et dans la ville. — Dès ce jour, lui annonçÇa-t-on, vous êtes la fiancée du prince.
— Je veux bien l’épouser, dit-elle, mais seulement au un an.
Petit Cendron était rentrée au logis. Sa robe et ses Parures étaient enfermées dans leur modeste écrin. Les deux soeurs se précipitèrent vers elle.
— Petit Cendron il paraît qu’on a enfin découvert la beauté que l’on cherchait depuis tant de semaines — Est-elle ravissante ?
— Elle avait une robe : Éclat de Soleil.
— Certainement pas plus belle que moi !
Au grand étonnement des siens, le Pitcendras Lharassas ouvrit sa noisette et parut rayonnante comme l'astre du jour. Depuis ce temps, elle a épousé le prince royal, comme il était convenu.
Je passe par mon pré,
Mon conte est terminé.
Conté par ma grand-mère, Mme Jean Laurent, en Décembre 1949. Gaston Maugard, Contes des Pyrénées, Paris, Érasme, 1955, p. 65-70 (« Contes Merveilleux des provinces de France »).",510 A
ptite_cendrillouse_acadie,Amérique,Acadie,"Une fois il Y avait un veuf qu’avait marié une veuve et ils aviont chacun une fille. La fille du veuf était assez belle et assez bounne que tous ceux qui la voyaient pouvions pas s'arrêter de l’aimer ; mais la fille de la veuve avait tous les vices et elle était assez laide qu'elle faisait peur. Ils l’appeliont la Grousse Laide. Une fois que le veuf et la veuve ont été mariés, la Grousse Laide et sa mère ont coummencé à être jalouses de la fille du veuf et elles se sont mises à la maltraiter. Elles l’ont mise à sougner la maçonne, parmi la cendre, et elles l'emmeniont jamais en nunne part. Elle était tout le temps en guenilles et tout le monde l’appelait la P’tite Cendrillouse. Une bonne journée, sa deuxième mère qui la héissait à mort et qui faisait tout ce qu’elle pouvait pour la faire enrager, l’a envoyé mener les vaches au parc et avant de partir, elle y a baillé un fuseau avec de la filasse dessus puis lui a dit : « Avant de t’en revenir, ce soir, tu fileras du fil aussi fin coumme tu pourras et puis, prends garde à toi, si tu fais pas ça, t’attraperas des bons coups ».
La P’tite Cendrillouse a pas osé rien dire. Elle a pré le fuseau, pis elle a parti pour aller mener les vaches. Elle savait bien qu’elle pouvait pas filer du fil avec pas de quenouille et pas de rouet. Elle s’est mise à brâiller. Bientôt quand elle a arrivé du long d'un pont, elle a t-i'pas échappé son fuseau ? Le fuseau a roulé sous le pont, puis
quand elle s'a penchée pour regarder iou-ce qu'il avait été, elle a vu trois vieilles femmes qu'étiont en frais de, faire l’ouvrage de la maison. Cétait trois fées, mais la P'tite Cendrillouse le savait pas. Elle leur a huché : « Mesdames, mesdames, baillez-moi mon petit fuseau, mesdames ». Les trois vieilles femmes ont regardé en l'air, puis quand elles ont vu la P'tite Cendrillouse, elles ont dit : « Descendez icitte, nous filerons votre fil ». La P'tite Cendrillouse a descendu sous le pont, puis y a une des vieilles femmes qu'a dit : « Tchins, voilà un balai. Tandis qu’on filera ton fil tu balieras notre place ». La P'tite Cendrillouse était assez contente de voir que les vieilles femmes alliont filer son fil qu’elle s’est mise à balier la place du mieux qu’elle pouvait. Bientôt une des fées a demandé à la P'tite Cendrillouse : « Dites-nous donc, quoi ce que vous trouvez dans notre place ? - Oh, la P'tite Cendrillouse dit, je trouve du ruban, des roses..., des diamants... » Tout de suite les fées s’avont mises à l'aimer et pis elles y avont filé du fil qu'était fin comme de la soie. Quand elles l'ont eu fini, elles avont gardé la P’tite Cendrillouse un petit élan avec eux pour la faire parler et puis quand elle a été partie, y a une des fées qu'a dit : « Faut y faire des souhaits ». La première dit : « Je souhaite qu’elle soit encore bien plus belle qu’elle est et qu’elle chante comme une sereine et que l'herbe fleurisse partout devant elle ». La deuxième dit : « Je souhaite qu'elle ait trois robes, une couleur des étoiles, une couleur de la lune et une autre couleur du soleil ». La troisième dit : « Je souhaite qu’elle marie le fils du roi ».
Pendant que les fées y faisiont des souhaits, la P'tite Cendrillouse, qui s’en allait chez eux avec ses vaches et son fudeau de fil, s’est mise à chanter comme une sereine et à tout les pas qu'elle faisait l'herbe fleurissait devant elle. Puis tout d'un coup y a trois robes qui lui avont tombé dans elle bras. Le P'tit Cendrillouse a resté toute étonnée mais elle
a pensé - Ces robes-là m'appartchenont, je m'en vas les garder. Mais elle savait bien que si elle les emportait chez eux, la Grousse Laide et se mère y outeriont. Ça fait qu’elle a ris les robes avant d'arriver à la maison puis elle a été les cacher dans un creux d’arbre. Après ca la P'tite Cendrillouse a parti à marcher puis a s’est mise à chanter. Sur ces entrefaites-là, la Grousse Laide a sorti dehors puis elle a entendu ce beau chant-là. Tout de suite elle a appelé sa mère puis elle y a dit : « Ecoutez voir, y a une musique qui joue en quèque part au loin ». Sa mère dit : « T'as raison ». Bientôt, elles avont vu venir la P'tite Cendrillouse et puis elles s’avont aperçu que c'était elle qui chantait. Puis à tous les pas qu’elle faisait l'herbe fleurissait devant elle. Quand elle a été quasiment rendue à la maison, la Grousse Laide et sa mère ont été au devant d’elle et puis lui ont demandé : « Quoi ce qui t'as arrivé ? ». La P'tite Cendrillouse qui contait jamais de menteries leur a tout conté tel que c'était, puis elle leur a montré le beau fil que les vieilles femmes aviont filé. Tout de suite la mère de la Grousse Laide a vu que c'était des fées qui y aviont fait des souhaits, ça fait qu'elle dit à la Grousse Laide : « Demain, c’est toi qui iras mener les vaches au parc et puis, quand t’arrives du long du pont ioù que les trois vieilles femmes sont, tu laisseras tomber ton fuseau et peutêtre bien qu’elles te feront descendre et qu'elles te feront des souhaits... ». Comme de fait, le lendemar matin la Grousse Laide a parti pour aller mener les vaches au parc et sa mère y a baillé un fuseau de fil. Quand La Grousse Laide a arrivé du long du pont ioù ce que la P'tite Cendrillouse avait été, elle s’a penché puis a regardé par un trou qu’il y avait dans le mitan du pont, puis elle a vu les trois vieilles femmes qu’étiont en frais de faire l'ouvrage de la maison. Tout de suite, elle a pas perdu de temps, elle a garroché son fuseau puis elle a-t-y pas fessé une des vieilles femmes par la tête ? Quand les trois fées ont regardé en
l'air pour voir ce qu'il y avait là, la Grousse Laide leur a huché : « Mesdames, mesdames, baillez-moi mon petit fuseau, mesdames ». Y a une des fées qui a répondu : « Descendez icitte, nous filerons votre fil ». La Grousse Laide a descendu, puis tandis que les fées filiont son fil, elles y faisaient balier la place. Bientôt, y a une des fées qui y a demandé : « Quoi ce que vous trouvez dans notre place ? » La Grousse Laide qui était paresseuse a coummencé à se tirer en l'air puis à se faire zire, puis elle a dit : « Je trouve des lêches, des sarpents, des crapauds, des gornouilles, des lazards... brrr ». Aussitôt qu’elle a dit ça, les fées la héissions assez pour la tuer, puis y avont filé du fil, c'était pareil comme des cochures. Quand elle a été partie, y a une des fées qu'a dit : « Faut lui faire des souhaits ». La première dit : « Je souhaite qu'elle soit encore cent fois plus laide qu’elle est et qu'à tous les pas qu'elle fait, l'herbe brûle devant elle ». La deuxième dit : « Je souhaite qu’à toutes les fois qu'elle ouvre la goule, qu'elle beugle comme un animaux ». La troisième fée dit : « Je souhaite qu’elle mourut vieille fille ». Tandis ce temps-là, la Grousse Laide s’est mise en chemin puis quand elle est arrivée un grand bout, elle s’est mise à chanter. C'était la brunante. Bientôt sa mère est sortie dehors pour ramanser des écopeaux, puis elle est rentrée tout de suite, blême comme une coiffe. Elle dit à la P’tite Cendillouse qui était dans le coin de la maçounne : « Ya quelque bête faroce dans les environs. Je vois rien mais je l'entends beugler ». La P'tite Cendrillouse et sa deuxième mère s’avont mis à regarder au châssis, puis bientôt elles s’avont aperçu que c'était la Grousse Laide qui s'en revenait avec les vaches et qui s’essayait à chanter. Et puis
partout ioù ce qu'elle marchait, l’harbe brûlait devant elle. Sa fille était encore plus laide et plus folle qu'auparavant Puis quand elle a vu le filé qui étaiit filé comme des cochures, elle a vu tout de suite que les fées y aviont fait des mauvais souhaits. Là, la Grousse Laide et sa mère s’avont mis à héir et à maltraiter la P’tite Cendrillouse encore bien plus.
Le dimanche d’après, la Grousse Laide puis sa mère et puis le père de la P’tite Cendrillouse avont parti pour aller à l’église et puis, comme de la coutume, ils l’avont laissé toute seule à sougner la maçounne. Aussitôt qu’ils avont été partis, la P’tite Cendrillouse s’est lavée puis elle a couru à son creux d’arbre et puis elle a mis sa robe couleur des étoiles. Quand elle a été toute greyée comme il faut, elle a été à l’église et puis elle a été se mettre dans l'allée pas loin de leur banc. Bientôt la Grousse Laide s’est déviré la tête et puis elle a aperçu cette belle fillelà qu’était si bien greyée. Elle a commencé à dire : « Ma mère, faisons-la mettre dans notre banc ». Pour avoir sa tranquillité sa mère a dit : « Fais-la mettre ». Ça fait que la Grousse Laide a été prendre la P'tite Cendrillouse qu’elle connaissait pas, puis elle l’a fait mettre dans leur banc. Le temps de la messe elle s’est mise à gratter après ses épinglettes et ses joncs et ses pend-d'oreilles. Bientôt, la P’tite Cendrillouse s’est déviré de bord et puis elle lui a baillé sa main dans la face. La Grousse Laide s'est mise à saigner du nez et puis sa mère a pris son mouchoir et puis elle l’a essuyée du mieux qu'elle a pu. Quand la P'tite Cendrillouse s’est aperçu que la messe était quasiment finie, elle est sortie de l'église du plus vite qu'elle pouvait, puis elle a été à son creux d'arbre serrer sa robe couleur des étoiles. Elle a mis sa robe de tous les jours et puis elle a couru chez eux sougner la maçounne avant que son père et la Grousse Laide et sa mère eurent le
temps d’arriver. Le fils du roi qui avait été à la messe avait remarqué la belle fille qui avait été se mettre dans le banc du père de la P’tite Cendrillouse. Il la trouvait assez à son goût qu’il avait pas pu s’ôter les yeux de dessus quasiment tout le temps de la messe. Il a été pour parler quand elle est sortie de l’église, mais il a pas eu la chance parce qu’elle est sortie trop pressée. Une fois que la messe a été finie, il a bien été se mettre dans son banc, mais le père de la P’tite Cendrillouse et la Grousse Laide et sa mère la connaissiont point. Il s’est aussi émoyé d’elle à l’entour de l’église et dans tout le pays, mais partout ioù-ce qu’il a été ils lui aviont dit qu’ils aviont jamais vu cette bellefille-là auparavant. Le fils du roi a pensé : dimanche qui vient, si elle est à l’église, ça chauffera si je peux pas y parler.
Quand la Grousse Laide et sa mère et le père de la P'tite Cendrillouse se rangirent de l’église, la Grousse Laide fut à la P’tite Cendrillouse qui était venue se remettre dans le coin de la maçounne, puis elle lui a dit : « T’as pas vu la belle fille qui est venue se mettre dans notre banc aujourd’hui ? ». La P’tite Cendrillouse répondit : « Oui, puis cette belle fille-là t’a toujours baïllé une bonne tape dans ta face ». La Grousse Laide dit : « Ma mère, ma mère, qui ce qui lui a dit ça, ma mère ? ». La mère de la Grousse Laide dit : « Darde-toi donc dessus puis paume-la à mort ». La Grousse Laide s’est dardée sur la P’tite Cendrillouse puis l’a battue pour une heure de temps.
Quand ça venu le deuxième dimanche, la Grousse
Laide et sa mère et la père de la P’tite Cendrillouse avont encore parti pour aller à la messe puis ils avont laissé P'tite Cendrillouse toute seule à la maison. Aussitôt qu'ils avont été partis, elle a couru à son creux d’arbre, puis
Grousse Laide dit : « Ma mère, qui ce qui lui a dit ça, ma mère ? » Sa mère dit : « Darde-toi donc dessus puis tu y battras de bons coups ». La Grousse Laide a encore battu la P'tite Cendrillouse pour une heure de temps.
À cette heure, le fils du roi quand il a été rendu à son château a conté au roi tout ce qui s'était passé à l’église, et puis il lui a montré le soulier qu’il avait trouvé sur le marche-pied de l’église. Il dit au roi que, si il ne pouvait pas marier la fille qui avait perdu le soulier, qu’il mourrait. Tout de suite le roi a commandé à ses vâlets d’aller partout dans le pays et de dire à toutes les filles de venir au château. Quand toutes les filles avont été au château, le roi leur a dit que celle-là qui pourrait mettre le soulier que son garçon avait trouvé, le marierait. Les filles ont coummencé à essayer la soulier. Puis essayent, puis essayent. Elles aviont toutes les pieds trop gros. Bien sûr, la Grousse Laide était là. Quand est venu son tour pour essayer le soulier, elle avait les pieds tout bossus, cornus et elle pouvait pas le mettre. Sa mère qui était là avec elle a pris un rasoir, puis elle s’est mise à lui chacotter les talons. La Grousse Laide poussait des cris abominables, puis le sang coulait sur tous les bords. Sa mère disait : « Endure pour marier le fils du roi ». Bientôt le roi est arrivé, puis quand il a vu ça, il a pris le rasoir puis il l'a jeté là-bas. Il dit : « Je veux pas que personne se chacotte les talons pour mettre le soulier. » La Grousse Laide a été obligée de se haler d’un bord et puis se faire renifler ailleurs.
Quand toutes les filles qui aviont été au château eurent fini d’essayer le soulier, il n’y en avait pas une qui avait pu le mettre. Elles aviont toutes les pieds trop gros ou trop longs. Avant de les renvoyer, le roi a rassemblé autour de lui tout le monde qu’il y avait là et puis il leur a dit : « Toutes les filles du pays sont-elles icitte ? » Le
père de la P'tite Cendrillouse s’est avancé et puis il a dit au roi : « J'ai une fille chez nous qu'ils l'appeliont la P'tite Cendrillouse et qui sougne tout le temps la maçounne. Ma femme a dit que ça ne valait pas la peine de l’emmener icitte ». Le roi s'est retourné par ses vâlets et il leur a dit : « Allez la quérir tout de suite. Je veux que toutes les filles du pays, sans en manquer une, veniont essayer le soulier ». Les vâlets du roi sont partis sur la minute, avec une belle carrosse pour aller quérir la P’tite Cendrillouse. Quand elle les a vu arriver et puis qu’ils y eurent dit que le roi voulait qu'elle allât essayer un soulier que son garçon avait trouvé sur le marche-pied de l'église, elle a vu tout de suite que c'était celui-là qu’elle avait perdu. Elle s’est toute lavée puis peignée comme il faut, puis quand elle a eu fini elle a été à son creux d’arbre, puis elle a mis sa robe couleur de la lune qu’elle avait mise la dargnére fois. Quand elle est venue pour embarquer dans la carrosse, les vâlets du roi faisiont rien que de calouetter. Ils aviont jamais vu une si belle personne de leur vie. Ils avont emmené la P'tite Cendrillouse au château. Quand elle a été rentrée dans le château, le monde qu’il y avait là, surtout son père, puis la Grousse Laide, puis la mère de la Grousse Laide étiont assez surpris qu'ils pouviont pas croire que c'était elle. Le fils du roi, lui, l'a reconnue tout de suite. Quand il lui a présenté le soulier, la P'tite Cendrillouse qui était toute entourée de monde, l’a mis sans misère. Quand elle a eu mis le soulier, le roi l'a prise par la main, puis il lui a de demandé si elle voulit avoir son garçon en mariage. La P'tite Cendrillouse s'est fait sourire, puis elle a répondu qu'oui. Le roi a tenu sa promesse. La P'tite Cendrillouse a marié le fils du roi. Les noces ont duré un mols de temps et il y a eu dans tout le pays des grandes réjouissances. Puis une fois qu'ils ont été mariés, le fils du roi et la P'tite Cendrillouse ont
élevé une grousse famille, puis ils avont êté heureux le restant de leurs jours.
La Grousse Laide, elle, s’en est allée chez eux avec sa mère, se faire djéri les talons, puis tel que les fées lui aviont souhaité, elle est morte vieille fille.
Les Archives de folklore, 3, Québec
Université Laval, 1948, p. 21-26.",480 + 510 A
