Filename,Continent ,Country,Content,Types_ATU
cendrouse_poitou,Europe,France (poitou),"La Cendrouse
Poitou
Il y avait une fois des gens riches, des seigneurs, et qui avaient trois filles. Il y en avait deux qui étaient fières, fières! Et puis, la troisième, bonnes gens, était méprisée, elle ne s'émouvait pas comme les autres, et elle restait toujours une partie dans le coin du feu, et on l’avait baptisée « la Cendrouse». Quand les deux aînées allaient se promener, elles demandaient à la Cendrouse:
— Allons, Cendrouse, tu ne veux pas venir avec nous autres te promener ?
— Ah non! Je ne veux pas y aller de fait!
— Ah, Cendrouse! Tu ne seras toujours qu’une Cendrouse, va! Toujours gratter les cendres! Toujours rester dans le coin du feu!
Le papa s’en va à une foire, bien loin. Il demande à ses filles :
— Allons, mes filles! Que voulez-vous que je vous apporte ? Voilà l’aînée qui dit:
— Ah! Papa! Vous m'apporterez une belle robe, ce que vous pourrez trouver de plus beau, d’une telle couleur. Et l’autre de même.
— Hé bien! Et toi, Cendrouse, qu'est-ce que je t'apporterai ? — Ah! Papa, une noisette, si vous voulez!
— Ah! Frugale 3! Tu aimes bien mieux avoir quelque chose
Versions françaises
pour manger que d'avoir une belle toDe, pas vrai, toi? Ah! Que tu as de malheur! Ah Pauvre Cendrouse !
Voilà que le papa leur apporte bien ce qu'elles avaient demandé. Il apporte deux jolies robes à ses deux filles, qui étaient fières, tout à fait ce qu'il y avait de plus beau; et il apporta une noisette pour la Cendrouse.
Le dimanche vint. Voilà les deux filles qui s’habillent dans leurs beaux habits en disant à la Cendrouse :
— Tu ne veux pas venir, toi, à la messe, hein ? Ah! Cendrouse ! Et elles partirent à la messe.
Voilà bien vite ma Cendrouse qui ouvre sa noisette. Elle trouva une belle voiture, bien attelée, deux fameux chevaux, un cocher, et des habits-là qui étaient quatre fois plus beaux que ceux de ses sœurs. Et la voilà bien vite qui s’habille, qui monte dans sa voiture, et elle arrive encore aussi tôt à la messe que ses sœurs. Et, quand ils virent arriver cette voiture, tout le monde était occupé de regarder. — À qui qu’ol est cette voiture ? À qui qu'ol est cette voiture ? Ah!
Elle entre à la messe.
Quand la messe fut finie, elle monte dans sa voiture, et «touche, cocher!» Ah! elle fut tantôt rendue 4! Et personne ne pouvait s’imaginer qui était cette belle demoiselle. Quand ses sœurs furent rendues, elles dirent à la Cendrouse, qui était dans le coin de son feu : — Ah ! Ma pauvre Cendrouse! Si tu étais venue à la messe, tu aurais vu la plus belle demoiselle, la plus belle demoiselle, que personne la connait, que personne en a vu une plus belle dans le monde ! Un cocher, deux chevaus, ah ! - Oh! Qu'elle soit tant belle qu'elle voudra, elle n'est pas plus belle que moi !
La Cendrouse
- Hein! Cendrouse, qu'est-ce que tu dis là? Elle n’est pas plus belle que toi? Ab, mon Dieu! Qu'est-ce que tu dis là ?
Allons, l'autre dimanche vint. Il fallut encore aller à la MESSE.
— Allons! Qu'elles dirent encore à la Cendrouse avant de partir, allons, Cendrouse ! Tu ne veux pas venir à la messe, aneu, voir cette demoiselle ? Elle y sera peut-être encore. Une si jolie voiture!
— Ah! Je ne veux pas y aller, non! qu’elle dit.
— Ah! Tu aimes mieux gratter tes cendres, pardié! Et d’abord qu’elles furent parties, elle ouvre sa noisette et s'habille. Elle monte en voiture; elle fut encore si tôt rendue comme ses sœurs.
Et voilà encore tout le monde à regarder, et à dire: — Qui qu’a peut être ? Qui qu’a peut être ? Une si jolie voiture, si jolie et que personne la connaît!
Quand la messe fut dite, elle sort et elle monte dans sa voiture. En montant dans sa voiture, elle laissa tomber une de ses pantoufles. Et précisément, c’est le fils du roi qui la ramassa, sans que personne s’en aperçût. Et le voilà, après, qui dit:
— Ah! Voilà une jolie pantoufle! Celle-là, à qui elle ira, qu’elle chaussera bien, ça sera ma femme ! Je l’épouserai. Ah, mon Dieu! Si vous aviez vu toutes ces princesses, toutes sortes d’espèces de demoiselles, à se rendre là et essayer la pantoufle, et essayer! La pantoufle ne chaussaïit point aucun pied, rien du tout, elle n’allait pas à aucune. — Ah, Cendrouse ! Quand elles furent rendues. Elle y était bien encore, cette belle demoiselle. Va, si t'avais venu, tu l’aurais vue; va, je t’assure que c'est une belle demoiselle !
— Qu'elle soit tant belle qu’elle voudra! Elle n’est pas plus belle que moi.
Versions francais
Allons, ce fut remis au dimanche d'apès pour essayer encore cette pantoufle. Toutes les princesses de tous pays, elles venaient pour essayer cette pantoufle. Et la Cendrouse s'y rend aussi tout chapetit, point montée dans sa voiture, cette fois, toute Cendrouse, pardié ! Voilà toutes les princesses après avoir essayé cette pantoufle, elle n'allait point à aucun pied. Ma Cendrouse s'approche, essaie cette pantoufle, enfin, elle était comme moulée à son pied ! Elle lui allait ! Et puis, comme il avait dit que celle-là à qui ouvre sa noisette, et elle présanta cette belle voiture ! Elle s'habilla, qu'il n'y avait point de princesse si belle comme elle était, bien sûr ! Et puis, elle monta dans sa voiture avec le fils du roi, et les voilà partis ! Ainsi la Cendrouse était beaucoup plus belle que ses soeurs, après !",510 A
cendrillonne_mauricie,Amérique,La Mauricie,"Une fois c'était un paysan. Il avait une petite fille, elle s'appelait Alexandrine. Après que sa mère a été morte — la petite fille avait rien que deux ans — son père dit : « Elle est trop jeune pour rester toute seule. » Ça fait qu’il a rencontré une vieille femme, puis il lui a demandé pour l’épouser. Il lui a dit qu’il avait une petite fille. La femme, elle, s’est dit en elle même : « Je vas avoir soin de la petite fille, mais je vas avoir à manger trois fois par jour. »
Mais, quand elle a vu Alexandrine, elle trouvait qu’elle était bien belle. Son père, le soir, quand il arrivait de l’ouvrage, bien, il s’occupait d’Alexandrine. Quand elle a eu à peu près quatre ou cinq ans, là, elle a commencé à lui envoyer chercher de l’eau au puits. Tu comprends, elle était toujours toute sale, elle se traînait à quatre pattes à terre. Sa robe était toujours déchirée. Quand son père y était pas, elle la faisait manger dans un coin. Quand les voisines venaient pour la voir, elles lui demandaient comment ça se faisait qu’elle était toujours sale de même. Là, bien, la femme, elle dit:
— C’est une vraie cendrillonne. Là, on va l’appeler Cendrillonne, elle est toujours sale, elle veut jamais se laver. La conteuse utilise le plus souvent le nom de Cendrillonne quoique celui de Cendrillon revienne à plusieurs endroits ; nous uniformisons avec Cendrillonne qui est l'appellation la plus fréquente.
Elle disait que c'était la petite fille qui voulait pas se laver.
Et puis, quand elle cst venue plus vieille là, disons vers l'âge de six ou sept ans, bien là, lle a commencé à lui faire laver ses planchers. Comme il y avait pas de brosse, il y avait pas de guenille, rien, Ça fait que fallait qu’elle aille se chercher des branches. Elle prenait des branches de sapin, puis elle lavait le plancher; c'était comme une brosse, elle lavait tout le plancher à genoux avec ça. Et puis il fallait qu’elle retourne en chercher d’autres pour l’assécher, son plancher. Là, quand elle se levait de là, elle était encore sale, hein. Puis là bien, la vieille, elle la chicanait, elle la traitait de salope. Elle disait:
— Tu es toujours une vraie cendrillonne ! Mais à la minute que son père arrivait, le soir, bon, elle traitait Cendrillonne pareil comme si rien avait été. Mais là, elle disait toujours à Cendrillonne:
— Si tu en parles à ton père, je vas faire la même chose à ton pere.
Comme Cendrillonne aimait son père, elle voulait pas que rien lui arrive à son père, ça fait qu’elle faisait voir de rien.
Mais une fois, son père avait cru de s’apercevoir... Îl est arrivé plus vite qu’il pensait, puis il avait cru de s’apercevoir que sa femme maganait Cendrillonne.
— Mais c’est elle qui m’a demandé de l'appeler de même parce qu’elle aime ça, ce nom-là. Il a demandé à Alexandrine ; il dit:
— C'est-il vrai ?
Elle dit :
— Oui, j’hais pas ça, ce nom-là.
Mais là, son pere a réussi à emmener sà fille loin un peu de sa femme, puis il lui a demandé voir si, le jour, si elle était maganée. Elle lui a dit que non, qu’elle en avait bien soin, puis qu’elle la faisait manger; elle lui a pas dit
qu'elle mangeait dans un coin puis qu’elle mangeait rien que les restants de table puis tout ça, parce qu’elle avait trop peur que son pere soit magané.
Quand elle est venue assez vieille là, vers l’âge de seize ou dix-sept ans, prête à marier là, la femme, elle, voulait la garder avec elle, mais la faire travailler. Elle, son plaisir, c'était de la maganer quand son mari était parti. Elle lui en voulait ; elle était tellement jalouse d’elle que plus qu'elle lui en faisait, la femme, plus qu’elle était contente. Quand elle s’est aperçue que Cendrillonne se plaignait pas, bien là, c'était encore bien pire : elle exagérait à tous les jours.
Puis, un soir, ils ont eu une nouvelle qu’il s’en venait un prince au château. Il invitait toutes les filles de la région, qu'il se cherchait une femme, puis qu’il choisirait la plus belle. Le soir, Cendrillonne, elle a dit à son père:
— J'aimerais ça y aller. Son père lui dit:
— C’est correct. Je vas y aller t’acheter des toilettes, puis tu iras.
Mais après que Cendrillonne a été sortie, sa femme a dit à son père:
— Tu y penses pas! Envoyer ta fille à la veillée du prince ! Peut-être qu’elle sera maganée, quand ils verront que tu es rien qu’un simple paysan... Puis elle aimera peut-être pas ça, elle qui a jamais parti de la maison. Elle a découragé le père de Cendrillonne de la laisser aller. Quand Cendrillonne est rentrée dans la maison, elle qui était toute contente d’aller au bal, là son père a essayé de lui faire comprendre que si elle allait au bal, peut-être qu’elle serait choisie par le prince, puis qu'elle serait misérable : elle partirait, elle s’éloignerait puis, lui, il aurait de la peine. Elle, à la minute qu'elle a entendu dire que son père aurait de la peine, elle dit:
— Correct, j'y ai pas. C'est correct, je vais rester avec vous ; je veux pas que vous ayez de peine. Puis c'est vrai, peut-être que je m'ennuierais.
Après que son père a été couché, puis sa mère, sa marraine la fée est apparue à Cendrillonne. Elle a dit à Cendrillonne :
— Tu vas y aller au bal.
— Non. Ma mère va chicaner mon père.
— Tu vas aller au bal, tu vas aller rencontrer le prince.
Puis occupe-toi pas de ta mère, je vas m'en occuper, moi. Mais comme sa mêre dormait pas, elle est venue voir par le trou de la serrure de sa chambre, pour voir qu'est-ce qui se passait dans la cuisine. Puis elle a vu la marraine de Cendrillonne. Là bien, avec sa baguette magique, Cendrillonne, le temps de le dire, était tout habillée comme une vraie princesse.
Elle était tellement belle ! Elle lui avait tout bouclé ses cheveux, ses cheveux sont tout venus bouclés, avec des beaux gros rubans roses qu'elle avait dans ses cheveux. Et puis elle lui avait fait mettre un beau bouquet de corsage de la même couleur que les boucles qu’elle avait dans ses cheveux. En tout cas, elle paraissait d’une vraie reine. Et puis elle lui avait donné ses gants; ils étaient faits avec le même matériel que sa robe. Là bien, elle a dit à Cendrillonne :
— Tu vas y aller, mais tu reviendras à minuit.
En tout cas, elle était tellement belle que la couronne qu'elle le avait, puis les diamants qu’elle avait après elle, ça érairait dans toute la cuisine. La vieille, sa mère, quand elle a vue ça, tu comprends qu’elle était jalouse de ça; mais elle apas fait voir de rien.
Après que Cendrillonne est partie pour aller au bal, là sa marraine l’a prévenue. Elle dit :
— Seulement, il faut que tu partes avant minuit parce qu'à minuit tu reprendras ta forme comme tu étais avant, tes vieilles robes puis tout ça, parce que, ça, la magie est bonne jusqu’à minuit.
Elle est allée au château. Puis là, le prince quand il l'à vue, tout de suite il est tombé en amour avec ; puis elle
aussi, elle aimait le prince. Mais quand, là, minuit a commencé à sonner, elle a dit au prince:
— Il faut que je m'en aille.
Le prince voulait pas, pas en tout! Il la tenait par la main. Elle a parti à courir, puis le prince la tenait par la main. Quand elle a arrivé dans l'escalier pour descendre, elle a commencé: ses souliers, ils se sont changés en sabots, tu sais, elle avait des vieux sabots. Mais, ses gants, le prince s’est trouvé à garder un de ses gants dans ses mains. Puis elle, elle a parti.
Quand elle a arrivé chez eux, la vieille l’attendait dans la cuisine, elle. Là, elle lui a dit:
— Je t'avais dit de pas aller au bal, puis tu y as été. Là, tu vas voir qu'est-ce que je vas faire à ton père! Là bien, Cendrillonne s’est mise à ses genoux : elle lui a dit de pas faire de mal à son père.
— Bien, si tu veux pas que je fasse de mal à ton père, tu vas partir, tu vas t’en aller, parce que si le prince vient qu’à te retrouver, si tu viens qu’à marier le prince, je ferai mourir ton père de misère, de peine et de... Cendrillonne lui a dit:
— Je vous jure que le prince me retrouvera pas, puis je vas m'en aller. Qu'’est-ce que vous allez dire à mon père parce que je suis partie ?
— Je lui dirai que c’est parce tu as été entêtée. Il a pas voulu que tu y ailles au bal du château, puis que tu t'es choquée, puis tu as parti.
— Bien, ça sera plus facile de même. Au lieu d’avoir de la peine, il va dire : Bien, c’est mieux de même. Ça fait que là, Cendrillonne s'est en allée dans le bois. Le lendemain matin, quand son mari s'est levé, il a demandé où est-ce qu'était Cendrillonne.
Sa femme lui a dit:
— Elle était en colère après toi, hier, tu as pas voulu qu'elle aille au bal du prince, ça fait qu elle s'est sauvée. Elle a dit qu’elle savait pas quand elle reviendrait. Elle est partie.
Le paysan, pour commencer, ça lui a fait de la peine. Mais là, la vieille l’a rassuré en lui disant que c’était juste une crise qu’elle avait faite, mais que avant longtemps...
Elle dit:
— Peut-être avant ce soir, elle va revenir.
La vieille le savait que Cendrillonne reviendrait pas, elle. Puis là, elle s’est dit en elle-même: « À cette heure, il va s’occuper de moi, à cette heure que Cendrillonne est partie ». Mais le prince, lui, après, tu sais, quand il a eu perdu Cendrillonne de vue, là il a commencé à faire une recherche où qu'elle pouvait être. Là, ils ont tout fait les maisons. Ils l'ont pas vue à nulle part. C’était des pages qu’il avait engagés pour la chercher. Ils ont rencontré le père à Cendrillonne dans le champ. Il était dans le champ. Ils lui ont demandé voir si sa fille... où elle était. Là, il a dit que sa fille était par- tie sur un coup de tête parce qu’il l'avait empêchée d’aller au bal, le soir, il y avait le bal du château, puis il l'avait empêchée d’y aller. Lui, il savait pas; sa femme lui avait pas dit que Cendrillonne était allée au bal. Puis là, ils ont dit:
— C’est parce qu'hier il est venu une fille, une vraie princesse, au bal. Et puis si on la trouve pas, on va être condamné à mort.
Tous ceux à qui le prince avait demandé, faudrait qu'ils cherchent tant qu'ils trouveraient pas la princesse, sinon ils seraient tous tués. Puis le prince, il faisait rien que pleurer: il l'aimait déjà ; il l’avait vue rien qu’un soir.
Et puis là les pages, en s’en retournant, le soir, il y en a un qui a rencontré Cendrillonne dans le bois, puis, lui, malgré qu'elle était mal habillé, il a cru de la reconnaître par sa figure. Là, il s’en assis avec elle, il s'est mis à lui parler. Le deuxième qui est passé, encore, il a recru de reconnaitre Cendrillonne. Mais lui, il lui a pas dit qu'il travaillait pour le roi, pour le prince. Il s'est assis, il lui a dit qu'il était écarté. Il lui a demandé:
— Qu'est-ce qu'une belle fille comme toi fait dans le bois ?
— Bien, une belle fille comme moi, je suis Cendrillonne.
— Qu'est-ce tu fais toute seule dans le bois ? Où est-ce que tu restes ?
— Je reste toute seule dans le bois; je vas finir mes jours
dans le bois.
Là, elle, à force de parler avec le page, elle l’a pris en amitié ; elle s’est mise à conter un peu qu’elle était allée à la veillée du prince, que le prince en partant, à minuit, qu'il avait gardé son gant. Là son autre gant... il lui manquait rien qu'un gant, l’autre gant elle l’avait sur elle; puis, en souvenir, elle l'avait attaché après sa ceinture de robe pour pas le perdre: parce qu'en ayant rien qu’un gant, c’est la seule chose qui avait pas disparu. Ça fait que le page, lui, quand il a vu le gant, il a bien vu que c'était bien elle qui était la princesse.
Là, il dit à Cendrillonne:
— Tu vas m’enseigner le chemin pour aller au village. Là, elle lui a dit par où passer.
Quand il a arrivé au château, il dit au prince:
— Je l'ai vue, la princesse.
Il lui a conté comment est-ce qu’elle était, puis qu'elle avait mis son gant attaché après la ceinture de robe. Le lendemain, le prince, lui, il est parti pour aller à sa recherche. Elle était assise au pied d'un arbre. Lui, le prince, bien, il a fait le moins de bruit possible pour arriver au ras elle. Et puis elle, d’un coup, elle s’est aperçue que les branches bougeaient, ça fait qu’elle s’est on retournée, elle a vu le pince! Là, quand elle a vu le prince, elle s'est levée, elle lui a crié de pas approcher! Là, le prince a commencé à lui dire qu’il l’aimait, puis qu'il voulait qu'elle le marisse. Elle, elle lui a dit qu’elle pouvait pas faire ça, qu'elle avait fait une promesse que jamais qu'elle pourrait le marier. Mais quand elle a vu que le prince avançait tout le temps, puis
qu'il était pour la poigner, elle a parti à courir, puis elle est arrivée au ras un buisson. Elle s'est cachée dans le buisson. Là, lui, il a commencé à la chercher. Mais elle, elle s'était couchée, elle bougeait pas, pas en tout, pas en tout.
Ça fait qu’il a resté trois jours là, à essayer de la chercher.
Quand il a vu qu’il la trouvait pas, il a cru qu’elle était partie, ça fait qu’il est parti au château.
Il y avait une montagne pour traverser dans une autre place de l’autre côté, où qu’il y avait des arbres, mais il fallait qu’elle monte cette montagne-là. Là, elle a monté de peine et de misère. Elle voulait tellement que son père soit heureux, qu'il soit pas magané, ça lui a donné le courage de réussir à passer par-dessus la montagne, de traverser par l’autre bord. Ça s’est trouvé là dans l’automne là...
Le prince, lui, à force de la faire chercher, il la trouvait pas. De jour en jour, il l’aimait de plus en plus malgré qu’elle était pas là. Ca fait qu'il a tombé malade. Ça fait que le roi forçait les pages à essayer de la trouver. Une fois, le roi — c'était l'ouverture de la chasse —, il est parti avec ses chiens pour aller à chasse. Lui, quand il allait à la chasse, il allait toujours à la chasse de l’autre côté de la montagne. Il y avait un chemin secret qu'il avait, lui, pour traverser la montagne, parce qu’il y avait des chevreuils, il y avait toutes sortes d'animaux sauvages qu’il aimait à manger. Il était de l’autre côté de la montagne, il a aperçu Cendrillonne, mais elle, elle l’a pas vu. Elle entendait japper les chiens, mais, lui, elle l'a pas vu. Lui, il a cru, pas sa figure, de la reconnaître. Mais là, ça faisait tellement longtemps qu'il l'avait pas vue, puis qu’elle mangeait pas... elle était blême puis, tu sais, elle avait maigri, elle était déprimée, toute déchirée. Les chiens, il a envoyé ses chiens après. Là les chiens, eux autre, au lieu de lui faire du mal, ils l’ont tout entourée.
Elle s'est assise. Elle se demandait comment ça se fait qu'il y avait tant de chiens que ça qui étaient arrivés à elle tout d'un coup; elle s’est assise dans le milieu, puis les chiens l'ont entourée. Là bien, elle a commencé à flatter les chiens, puis à leur parler.
Mais le roi avançait toujours par en arrière, lui.
Elle a commencé à conter aux chiens... — pour elle, elle pouvait parler sans que les chiens disent rien —. Là, elle a commencé à dire aux chiens qu'eux autres ils étaient bien plus heureux qu’elle, qu'eux autres ils pou- vaient courir dans la nature, puis qu’ils pouvaient retourner dans leur foyer, tandis qu’elle, elle pouvait pas... Elle contait cela aux chiens.
Mais le roi, lui, quand il a été arrivé en arrière d’elle, il l’écoutait parler; elle a tout conté son histoire aux chiens : pour sa mère, comment est-ce qu’elle la maganait, puis que si elle avait accepté de marier le prince, que sa mère ferait mourir son père de misère.
Là, le roi lui a dit, il a répondu là-dessus:
— Crains rien, reviens au château avec moi, je te jure qu'elle sera punie.
Là elle, elle s’est levée pour partir, mais lui, il l'a poignée, puis il lui a dit que son fils, le prince, l’aimait, que si elle revenait pas, qu’il mourrait de peine!
Elle, elle a dit:
— Non, parce que je veux pas que mon père meure, puis qu’il meure de misère. Ma mère va lui faire toutes les misères voulues pour ça.
Le roi dit:
— Non, je vas arranger ça.
Ça fait qu'il l’a emmenée au château. Tu comprends, quand le prince l’a vue arriver, il s'est trouvé guéri, lui. Là, ils lui ont fait faire des belles robes; ils lui ont fait faire toutes les toilettes dignes d'elle.
Là, ils ont fait venir son père à elle, au château. Quand le père de Cendrillonne est arrivé au château, là, elle, elle s'est jetée dans ses bras. Là, son père a réalisé qu'elle avait
été maganée par sa femme. Puis là, le roi, il a tout conté à son père. La fille, Cendrillonne, voulait pas lui conter, à son père, mais le roi lui a tout conté. Là lui, il s’est trouvé — parce qu’il s’était pas aperçu que sa femme avait magané Cendrillonne, tu sais — il s’est trouvé tellement déçu de sa femme qu’il s’est mis à l’haïr.
Le roi a dit:
- Si vous voulez, vous allez être mon conseiller, mon bras droit au château, je vas vous engager. Son père a accepté, le père de Cendrillonne. Et puis là, ils se sont mariés.
Mais la vieille, elle, qui était restée toute seule dans la cabane, elle s’est trouvée bien choquée de ça, de voir que Cendrillonne avait gagné son point, puis qu’elle avait perdu son mari en plus. À tous les jours, plus qu’elle pensait à ça, plus qu’elle se choquait! Une bonne fois, les voisines ont commencé à se moquer d’elle, la vieille. Ça fait qu’il yaune voisine qui arrive, elle lui dit que son mari était grand-père, que Cendrillonne avait eu une petite fille. Là, elle a fait une colère assez forte qu’elle en est morte pendant sa colère! Depuis ce temps-là, bien, Cendrillonne vit heureuse au château, puis son père est toujours près d’elle. La Bête à sept têtes et autres contes de la Mauricie, présentés par Clément Legaré, Montréal, Les Quinze, 1980, p. 163-174.",510 A
